CREATE DATABASE QuantigrationRMA;
show databases;
5 rows in set (0.00 sec)

mysql> use QuantigrationRMA;
Database changed
mysql> CREATE TABLE Customers 
    -> (CustomerID INT NOT NULL, 
    -> FirstName VARCHAR(25),
    -> LastName VARCHAR(25),
    -> Street VARCHAR(50),
    -> City VARCHAR(50),
    -> State VARCHAR(25),
    -> ZipCode INT,
    -> Telephone VARCHAR(15),
    -> PRIMARY KEY (CustomerID));
Query OK, 0 rows affected (0.06 sec)

mysql> show tables;
+----------------------------+
| Tables_in_QuantigrationRMA |
+----------------------------+
| Customers                  |
+----------------------------+
1 row in set (0.00 sec)

mysql> describe Customers;
+------------+-------------+------+-----+---------+-------+
| Field      | Type        | Null | Key | Default | Extra |
+------------+-------------+------+-----+---------+-------+
| CustomerID | int(11)     | YES  |     | NULL    |       |
| FirstName  | varchar(25) | YES  |     | NULL    |       |
| LastName   | varchar(25) | YES  |     | NULL    |       |
| Street     | varchar(50) | YES  |     | NULL    |       |
| City       | varchar(50) | YES  |     | NULL    |       |
| State      | varchar(25) | YES  |     | NULL    |       |
| ZipCode    | int(11)     | YES  |     | NULL    |       |
| Telephone  | varchar(15) | YES  |     | NULL    |       |
+------------+-------------+------+-----+---------+-------+
8 rows in set (0.00 sec)

mysql> CREATE TABLE Orders
    -> (OrderID INT NOT NULL,
    -> SKU VARCHAR(20),
    -> Description VARCHAR(50),
    -> PRIMARY KEY (OrderID),
       FOREIGN KEY (CustomerID) REFERENCES Customers (CustomerID));
Query OK, 0 rows affected (0.05 sec)

mysql> show tables;
+----------------------------+
| Tables_in_QuantigrationRMA |
+----------------------------+
| Customers                  |
| Orders                     |
+----------------------------+
2 rows in set (0.00 sec)

mysql> describe Orders;
+-------------+-------------+------+-----+---------+-------+
| Field       | Type        | Null | Key | Default | Extra |
+-------------+-------------+------+-----+---------+-------+
| OrderID     | int(11)     | YES  |     | NULL    |       |
| SKU         | varchar(20) | YES  |     | NULL    |       |
| Description | varchar(50) | YES  |     | NULL    |       |
+-------------+-------------+------+-----+---------+-------+
3 rows in set (0.00 sec)
mysql> CREATE TABLE RMA
    -> (RMAID INT,
    -> OrderID INT,
    -> Step VARCHAR(50),
    -> Status VARCHAR(15),
    -> Reason VARCHAR(15));
Query OK, 0 rows affected (0.06 sec)

mysql> show tables;
+----------------------------+
| Tables_in_QuantigrationRMA |
+----------------------------+
| Customers                  |
| Orders                     |
| RMA                        |
+----------------------------+
3 rows in set (0.00 sec)

mysql> describe RMA;
+---------+-------------+------+-----+---------+-------+
| Field   | Type        | Null | Key | Default | Extra |
+---------+-------------+------+-----+---------+-------+
| RMAID   | int(11)     | YES  |     | NULL    |       |
| OrderID | int(11)     | YES  |     | NULL    |       |
| Step    | varchar(50) | YES  |     | NULL    |       |
| Status  | varchar(15) | YES  |     | NULL    |       |
| Reason  | varchar(15) | YES  |     | NULL    |       |
+---------+-------------+------+-----+---------+-------+
5 rows in set (0.00 sec)

# add CustomerID to be set as FK to Orders table with INT definition

mysql> ALTER TABLE Orders 
    -> ADD CustomerID INT;
    
Query OK, 0 rows affected (0.20 sec)
Records: 0  Duplicates: 0  Warnings: 0


mysql> ALTER TABLE Customers
    -> ADD PRIMARY KEY (CustomerID);
    
Query OK, 0 rows affected (0.20 sec)
Records: 0  Duplicates: 0  Warnings: 0

mysql> describe Orders;
+-------------+-------------+------+-----+---------+-------+
| Field       | Type        | Null | Key | Default | Extra |
+-------------+-------------+------+-----+---------+-------+
| OrderID     | int(11)     | NO   | PRI | 0       |       |
| SKU         | varchar(20) | YES  |     | NULL    |       |
| Description | varchar(50) | YES  |     | NULL    |       |
| CustomerID  | int(11)     | YES  |     | NULL    |       |
+-------------+-------------+------+-----+---------+-------+
4 rows in set (0.00 sec)

mysql> ALTER TABLE Orders
    -> ADD FOREIGN KEY (CustomerID) REFERENCES Customers (CustomerID);
Query OK, 0 rows affected (0.12 sec)
Records: 0  Duplicates: 0  Warnings: 0

mysql> Describe Orders;
+-------------+-------------+------+-----+---------+-------+
| Field       | Type        | Null | Key | Default | Extra |
+-------------+-------------+------+-----+---------+-------+
| OrderID     | int(11)     | NO   | PRI | 0       |       |
| SKU         | varchar(20) | YES  |     | NULL    |       |
| Description | varchar(50) | YES  |     | NULL    |       |
| CustomerID  | int(11)     | YES  | MUL | NULL    |       |
+-------------+-------------+------+-----+---------+-------+
4 rows in set (0.00 sec)

mysql> ALTER TABLE RMA
    -> ADD PRIMARY KEY (RMAID);
Query OK, 0 rows affected (0.23 sec)
Records: 0  Duplicates: 0  Warnings: 0

mysql> ALTER TABLE RMA
    -> ADD FOREIGN KEY (OrderID) REFERENCES Orders (OrderID);
Query OK, 0 rows affected (0.19 sec)
Records: 0  Duplicates: 0  Warnings: 0

mysql> describe RMA;
+---------+-------------+------+-----+---------+-------+
| Field   | Type        | Null | Key | Default | Extra |
+---------+-------------+------+-----+---------+-------+
| RMAID   | int(11)     | NO   | PRI | 0       |       |
| OrderID | int(11)     | YES  | MUL | NULL    |       |
| Step    | varchar(50) | YES  |     | NULL    |       |
| Status  | varchar(15) | YES  |     | NULL    |       |
| Reason  | varchar(15) | YES  |     | NULL    |       |
+---------+-------------+------+-----+---------+-------+
5 rows in set (0.00 sec)
mysql> INSERT INTO Customers VALUES
    -> (001, 'Alex', 'Fry', '345 Alice Court', 'Houston', 'Texas', 77080, '921-532-8894'),
    -> (002, 'Kimberly', 'Sternhoff', '9723 Bowling Dr', 'Plano', 'Texas', 75023, '212-634-5587'),
    -> (003, 'Peter', 'Hauser', '1293 Sterling Ln', 'Boise', 'Idaho', 83701, '842-971-0098'),
    -> (004, 'William', 'Overdorff', '4322 Neon Springs Dr', 'Alford', 'Florida', 32420, '442-871-7736'),
    -> (005, 'Katelyn', 'Malcolm', '821 Valley St', 'Gulfport', 'Mississippi', 39503, '612-832-0099'),
    -> (006, 'Grace', 'Peck', '7743 Alexander Ave', 'Pittsburgh', 'Pennsylvania', 15136, '412-643-5218'),
    -> (007, 'Cindy', 'Lui', '96 Crest Court', 'Bowling Green', 'Kentucky', 55648, '212-749-2387'),
    -> (008, 'Bruce', 'Miller', '8790 High Point Ln', 'Charleroi', 'Pennsylvania', 15022, '412-902-3441'),
    -> (009, 'Neil', 'Patterson', '12 Apple Tree Orchard', 'Belfast', 'Maine', 04915, '732-3957521'),
    -> (010, 'Molly', 'Vincent', '6209 Mission St', 'Omaha', 'Nebraska', 68127, '519-452-8601');
Query OK, 10 rows affected (0.02 sec)
Records: 10  Duplicates: 0  Warnings: 0

mysql> Select * FROM Customers;
+------------+-----------+-----------+-----------------------+---------------+--------------+---------+--------------+
| CustomerID | FirstName | LastName  | Street                | City          | State        | ZipCode | Telephone    |
+------------+-----------+-----------+-----------------------+---------------+--------------+---------+--------------+
|          1 | Alex      | Fry       | 345 Alice Court       | Houston       | Texas        |   77080 | 921-532-8894 |
|          2 | Kimberly  | Sternhoff | 9723 Bowling Dr       | Plano         | Texas        |   75023 | 212-634-5587 |
|          3 | Peter     | Hauser    | 1293 Sterling Ln      | Boise         | Idaho        |   83701 | 842-971-0098 |
|          4 | William   | Overdorff | 4322 Neon Springs Dr  | Alford        | Florida      |   32420 | 442-871-7736 |
|          5 | Katelyn   | Malcolm   | 821 Valley St         | Gulfport      | Mississippi  |   39503 | 612-832-0099 |
|          6 | Grace     | Peck      | 7743 Alexander Ave    | Pittsburgh    | Pennsylvania |   15136 | 412-643-5218 |
|          7 | Cindy     | Lui       | 96 Crest Court        | Bowling Green | Kentucky     |   55648 | 212-749-2387 |
|          8 | Bruce     | Miller    | 8790 High Point Ln    | Charleroi     | Pennsylvania |   15022 | 412-902-3441 |
|          9 | Neil      | Patterson | 12 Apple Tree Orchard | Belfast       | Maine        |    4915 | 732-3957521  |
|         10 | Molly     | Vincent   | 6209 Mission St       | Omaha         | Nebraska     |   68127 | 519-452-8601 |
+------------+-----------+-----------+-----------------------+---------------+--------------+---------+--------------+
10 rows in set (0.00 sec)

# request for collaborator view of customer table w/ customer to be returned as collaborator 

mysql> CREATE VIEW Collaborator AS 
    -> SELECT CustomerID AS CollaboratorID,
    -> FirstName,
    -> LastName,
    -> Street,
    -> City,
    -> State,
    -> ZipCode,
    -> Telephone
    -> FROM Customers;
Query OK, 0 rows affected (0.02 sec)

mysql> DESCRIBE Collaborator;
+----------------+-------------+------+-----+---------+-------+
| Field          | Type        | Null | Key | Default | Extra |
+----------------+-------------+------+-----+---------+-------+
| CollaboratorID | int(11)     | NO   |     | 0       |       |
| FirstName      | varchar(25) | YES  |     | NULL    |       |
| LastName       | varchar(25) | YES  |     | NULL    |       |
| Street         | varchar(50) | YES  |     | NULL    |       |
| City           | varchar(50) | YES  |     | NULL    |       |
| State          | varchar(25) | YES  |     | NULL    |       |
| ZipCode        | int(11)     | YES  |     | NULL    |       |
| Telephone      | varchar(15) | YES  |     | NULL    |       |
+----------------+-------------+------+-----+---------+-------+
8 rows in set (0.00 sec)

# Run select query to ensure collaborator table view successful 

mysql> SELECT * FROM Collaborator 
    -> LIMIT 5;
+----------------+-----------+-----------+----------------------+----------+-------------+---------+--------------+
| CollaboratorID | FirstName | LastName  | Street               | City     | State       | ZipCode | Telephone    |
+----------------+-----------+-----------+----------------------+----------+-------------+---------+--------------+
|              1 | Alex      | Fry       | 345 Alice Court      | Houston  | Texas       |   77080 | 921-532-8894 |
|              2 | Kimberly  | Sternhoff | 9723 Bowling Dr      | Plano    | Texas       |   75023 | 212-634-5587 |
|              3 | Peter     | Hauser    | 1293 Sterling Ln     | Boise    | Idaho       |   83701 | 842-971-0098 |
|              4 | William   | Overdorff | 4322 Neon Springs Dr | Alford   | Florida     |   32420 | 442-871-7736 |
|              5 | Katelyn   | Malcolm   | 821 Valley St        | Gulfport | Mississippi |   39503 | 612-832-0099 |
+----------------+-----------+-----------+----------------------+----------+-------------+---------+--------------+
5 rows in set (0.00 sec)

mysql> describe Orders;
+-------------+-------------+------+-----+---------+-------+
| Field       | Type        | Null | Key | Default | Extra |
+-------------+-------------+------+-----+---------+-------+
| OrderID     | int(11)     | NO   | PRI | 0       |       |
| SKU         | varchar(20) | YES  |     | NULL    |       |
| Description | varchar(50) | YES  |     | NULL    |       |
| CustomerID  | int(11)     | YES  | MUL | NULL    |       |
+-------------+-------------+------+-----+---------+-------+
4 rows in set (0.01 sec)

mysql> describe RMA;
+---------+-------------+------+-----+---------+-------+
| Field   | Type        | Null | Key | Default | Extra |
+---------+-------------+------+-----+---------+-------+
| RMAID   | int(11)     | NO   | PRI | 0       |       |
| OrderID | int(11)     | YES  | MUL | NULL    |       |
| Step    | varchar(50) | YES  |     | NULL    |       |
| Status  | varchar(15) | YES  |     | NULL    |       |
| Reason  | varchar(15) | YES  |     | NULL    |       |
+---------+-------------+------+-----+---------+-------+
5 rows in set (0.00 sec)

mysql> show tables;
+----------------------------+
| Tables_in_QuantigrationRMA |
+----------------------------+
| Collaborator               |
| Customers                  |
| Orders                     |
| RMA                        |
+----------------------------+
4 rows in set (0.00 sec)

#load csv files into corresponding tables

mysql> LOAD DATA INFILE 'customers.csv'
    -> INTO TABLE Customers
    -> FIELDS TERMINATED BY ',';
Query OK, 38162 rows affected (0.43 sec)
Records: 38162  Deleted: 0  Skipped: 0  Warnings: 0

mysql> LOAD DATA INFILE 'orders.csv'
    -> INTO TABLE Orders
    -> FIELDS TERMINATED BY ',';
Query OK, 37994 rows affected, 37994 warnings (0.36 sec)
Records: 37994  Deleted: 0  Skipped: 0  Warnings: 37994

mysql> LOAD DATA INFILE 'rma.csv' 
    -> INTO TABLE RMA
    -> FIELDS TERMINATED BY ',';
Query OK, 38162 rows affected (0.43 sec)
Records: 38162  Deleted: 0  Skipped: 0  Warnings: 0

# update Customer and Orders tables with new records 

describe Customers;
+------------+-------------+------+-----+---------+-------+
| Field      | Type        | Null | Key | Default | Extra |
+------------+-------------+------+-----+---------+-------+
| CustomerID | int(11)     | NO   | PRI | 0       |       |
| FirstName  | varchar(25) | YES  |     | NULL    |       |
| LastName   | varchar(25) | YES  |     | NULL    |       |
| Street     | varchar(50) | YES  |     | NULL    |       |
| City       | varchar(50) | YES  |     | NULL    |       |
| State      | varchar(25) | YES  |     | NULL    |       |
| ZipCode    | int(11)     | YES  |     | NULL    |       |
| Telephone  | varchar(15) | YES  |     | NULL    |       |
+------------+-------------+------+-----+---------+-------+
8 rows in set (0.00 sec)

mysql> INSERT INTO Customers VALUES 
    -> (100004, 'Luke', 'Skywalker', '17 Maiden Lane', 'New York', 'NY', 10222, '212-555-1234'),
    -> (100005, 'Winston', 'Smith', '128 Sycamore Street', 'Greensboro', 'NC', 27401, '919-555-6623'),
    -> (100006, 'MaryAnne', 'Jenkins', '2 Coconut Way', 'Jupiter', 'FL', 33458, '321-555-8907'),
    -> (100007, 'Janet', 'Williams', '58 Redondo Beach Blvd', 'Torrence', 'CA', 90501, '310-555-5678');
Query OK, 4 rows affected (0.02 sec)
Records: 4  Duplicates: 0  Warnings: 0

describe Orders;
+-------------+-------------+------+-----+---------+-------+
| Field       | Type        | Null | Key | Default | Extra |
+-------------+-------------+------+-----+---------+-------+
| OrderID     | int(11)     | NO   | PRI | 0       |       |
| CustomerID  | int(11)     | YES  | MUL | NULL    |       |
| SKU         | varchar(20) | YES  |     | NULL    |       |
| DESCRIPTION | varchar(50) | YES  |     | NULL    |       |
+-------------+-------------+------+-----+---------+-------+
4 rows in set (0.00 sec)

mysql> INSERT INTO Orders VALUES
    -> (1204305, 100004, 'ADV-24-10C', 'Advanced Switch 10GigE Copper 24 port'),
    -> (1204306, 100005, 'ADV-48-10F', 'Advanced Switch 10 GigE Copper/Fiber 44 port copper 4 port fiber'),
    -> (1204307, 100006, 'ENT-24-10F', 'Enterprise Switch 10GigE SFP+ 24 Port'),
    -> (1204308, 100007, 'ENT-48-10F', 'Enterprise Switch 10GigE SFP+ 48 port');
Query OK, 4 rows affected, 1 warning (0.03 sec)
Records: 4  Duplicates: 0  Warnings: 1

# update the status and step for the OrderID, 5175 to status = “Complete” and step = “Credit Customer Account.” 

describe RMA;
+---------+-------------+------+-----+---------+-------+
| Field   | Type        | Null | Key | Default | Extra |
+---------+-------------+------+-----+---------+-------+
| RMAID   | int(11)     | NO   | PRI | 0       |       |
| OrderID | int(11)     | YES  | MUL | NULL    |       |
| Step    | varchar(50) | YES  |     | NULL    |       |
| Status  | varchar(15) | YES  |     | NULL    |       |
| Reason  | varchar(15) | YES  |     | NULL    |       |
+---------+-------------+------+-----+---------+-------+
5 rows in set (0.00 sec)

# checked current status and step of OrderID 5175 prior to updating record 

mysql> SELECT Status, Step FROM RMA
    -> WHERE OrderID = 5175;
+---------+---------------------------------+
| Status  | Step                            |
+---------+---------------------------------+
| Pending | Awaiting customer Documentation |
+---------+---------------------------------+

mysql> #update OrderID 5175 status = “Complete” and step = “Credit Customer Account" in RMA table 
 
mysql> UPDATE RMA SET Status = 'Complete', Step = 'Credit Customer Account'
    -> WHERE OrderID = 5175;
Query OK, 1 row affected (0.01 sec)
Rows matched: 1  Changed: 1  Warnings: 0

#confirmed OrderID 5175 status and step updated in RMA table

mysql> SELECT * FROM RMA 
    -> WHERE OrderID = 5175;
+-------+---------+-------------------------+----------+-----------+
| RMAID | OrderID | Step                    | Status   | Reason    |
+-------+---------+-------------------------+----------+-----------+
| 31405 |    5175 | Credit Customer Account | Complete | Defective |
+-------+---------+-------------------------+----------+-----------+
1 row in set (0.00 sec)

# delete all records with a reason of “Rejected" in RMA table 

mysql> DELETE FROM RMA 
WHERE Reason = 'Rejected';
Query OK, 596 rows affected (0.25 sec)

# created output .csv of Orders table 

mysql> SELECT * FROM Orders into outfile '/home/workspace/orders2.csv' 
    -> FIELDS TERMINATED BY ',';
Query OK, 37998 rows affected (0.27 sec)

mysql> exit
Bye

#concatenated file to screen 
/workspace$ pwd
/workspace$ cat orders2.csv


# update recenty added customer states to non-abbreviations 

mysql> SELECT DISTINCT State FROM Customers;
+----------------+
| State          |
+----------------+
| Texas          |
| Idaho          |
| Florida        |
| Mississippi    |
| Pennsylvania   |
| Kentucky       |
| Maine          |
| Nebraska       |
| Connecticut    |
| Minnesota      |
| West Virginia  |
| Alabama        |
| Oregon         |
| North Carolina |
| Vermont        |
| Arkansas       |
| Iowa           |
| New Mexico     |
| South Dakota   |
| Montana        |
| Indiana        |
| Tennessee      |
| Washington     |
| Utah           |
| Arizona        |
| Wisconsin      |
| Oklahoma       |
| Delaware       |
| Louisiana      |
| Wyoming        |
| Hawaii         |
| Maryland       |
| New Hampshire  |
| Kansas         |
| California     |
| Colorado       |
| Rhode Island   |
| Ohio           |
| Nevada         |
| North Dakota   |
| Michigan       |
| Illinois       |
| New Jersey     |
| Missouri       |
| Georgia        |
| South Carolina |
| New York       |
| Massachusetts  |
| NY             |
| NC             |
| FL             |
| CA             |
+----------------+
52 rows in set (0.28 sec)


mysql> UPDATE Customers 
    -> SET State = 'New York'
    -> WHERE State = 'NY';
Query OK, 1 row affected (0.05 sec)
Rows matched: 1  Changed: 1  Warnings: 0
mysql> UPDATE Customers
    -> SET State = 'North Carolina'
    -> WHERE State = 'NC';
Query OK, 1 row affected (0.04 sec)
Rows matched: 1  Changed: 1  Warnings: 0
mysql> UPDATE Customers
    -> SET State = 'Florida'
    -> WHERE State = 'FL';
Query OK, 1 row affected (0.04 sec)
Rows matched: 1  Changed: 1  Warnings: 0
mysql> UPDATE Customers
    -> SET State = 'California'
    -> WHERE State = 'CA';
Query OK, 1 row affected (0.03 sec)
Rows matched: 1  Changed: 1  Warnings: 0

mysql> SELECT DISTINCT State FROM Customers;
+----------------+
| State          |
+----------------+
| Texas          |
| Idaho          |
| Florida        |
| Mississippi    |
| Pennsylvania   |
| Kentucky       |
| Maine          |
| Nebraska       |
| Connecticut    |
| Minnesota      |
| West Virginia  |
| Alabama        |
| Oregon         |
| North Carolina |
| Vermont        |
| Arkansas       |
| Iowa           |
| New Mexico     |
| South Dakota   |
| Montana        |
| Indiana        |
| Tennessee      |
| Washington     |
| Utah           |
| Arizona        |
| Wisconsin      |
| Oklahoma       |
| Delaware       |
| Louisiana      |
| Wyoming        |
| Hawaii         |
| Maryland       |
| New Hampshire  |
| Kansas         |
| California     |
| Colorado       |
| Rhode Island   |
| Ohio           |
| Nevada         |
| North Dakota   |
| Michigan       |
| Illinois       |
| New Jersey     |
| Missouri       |
| Georgia        |
| South Carolina |
| New York       |
| Massachusetts  |
+----------------+
48 rows in set (0.03 sec)




#### Analysis ###### 

# Which State currently has the most amount of customers? 

mysql> SELECT State, COUNT(*) AS num_of_customers
    -> FROM Customers
    -> GROUP BY State 
    -> ORDER BY num_of_customers DESC;
+----------------+------------------+
| State          | num_of_customers |
+----------------+------------------+
| Massachusetts  |              982 |
| Arkansas       |              854 |
| West Virginia  |              843 |
| Oregon         |              842 |
| Idaho          |              839 |
| Alabama        |              838 |
| Mississippi    |              835 |
| Tennessee      |              831 |
| Connecticut    |              830 |
| Delaware       |              824 |
| Wisconsin      |              822 |
| Kentucky       |              820 |
| Montana        |              820 |
| New Mexico     |              818 |
| Iowa           |              814 |
| Pennsylvania   |              813 |
| Indiana        |              811 |
| South Dakota   |              807 |
| Minnesota      |              801 |
| Louisiana      |              800 |
| Wyoming        |              795 |
| Vermont        |              793 |
| Hawaii         |              792 |
| New York       |              792 |
| Washington     |              791 |
| North Carolina |              786 |
| Arizona        |              784 |
| Missouri       |              782 |
| Maryland       |              777 |
| North Dakota   |              776 |
| Florida        |              774 |
| Rhode Island   |              773 |
| California     |              771 |
| New Hampshire  |              771 |
| Maine          |              760 |
| Michigan       |              760 |
| Utah           |              759 |
| Texas          |              759 |
| Illinois       |              758 |
| Oklahoma       |              756 |
| Nevada         |              755 |
| Ohio           |              746 |
| Nebraska       |              732 |
| Kansas         |              732 |
| Colorado       |              728 |
| New Jersey     |              725 |
| Georgia        |              724 |
| South Carolina |              713 |
+----------------+------------------+

# Which region has the largest customer base? 

mysql> SELECT 'Southwest' AS REGION, COUNT(*) AS num_of_customers
    -> FROM Customers
    -> WHERE State IN ('Arizona', 'New Mexico', 'Texas', 'Oklahoma')
    -> UNION
    -> SELECT 'Southeast' AS REGION, COUNT(*) AS num_of_customers
    -> FROM Customers
    -> WHERE State IN ('Arkansas', 'Louisiana', 'Mississippi', 'Alabama', 'Georgia', 'Florida', 'Kentucky', 'Tennessee', 'South Carolina', 'North Carolina', 'Virginia', 'West Virginia', 'Delaware', 'Maryland')
    -> UNION
    -> SELECT 'Northeast' AS REGION, COUNT(*) AS num_of_customers
    -> FROM Customers
    -> WHERE State IN ('Pennsylvania', 'New Jersey', 'New York', 'Connecticut', 'Rhode Island', 'Massachusetts', 'Vermont', 'New Hampshire', 'Maine')
    -> UNION
    -> SELECT 'Midwest' AS REGION, COUNT(*) AS num_of_customers
    -> FROM Customers
    -> WHERE State IN ('North Dakota', 'South Dakota', 'Kansas', 'Nebraska', 'Minnesota', 'Wisconsin', 'Iowa', 'Missouri', 'Michigan', 'Indiana', 'Illinois', 'Ohio')
    -> UNION
    -> SELECT 'West' AS REGION, COUNT(*) AS num_of_customers
    -> FROM Customers 
    -> WHERE State IN ('Washington', 'Idaho', 'Montana', 'Oregon', 'Wyoming', 'Colorado', 'Utah', 'Nevada', 'California');
    
+-----------+------------------+
| REGION    | num_of_customers |
+-----------+------------------+
| Southwest |             3117 |
| Southeast |            10419 |
| Northeast |             7239 |
| Midwest   |             9341 |
| West      |             7100 |
+-----------+------------------+
5 rows in set (0.08 sec)

# What are the top 3 products being sold? 

mysql> SELECT SKU, Description, COUNT(SKU) AS num_sold 
    -> FROM Orders
    -> GROUP BY SKU, Description 
    -> ORDER BY num_sold DESC;
+------------+----------------------------------------------------+----------+
| SKU        | Description                                        | num_sold |
+------------+----------------------------------------------------+----------+
| BAS-48-1 C | Basic Switch 10/100/1000 BaseT 48 port             |     8385 |
| ENT-48-40F | Enterprise Switch 40GigE SFP+ 48 port              |     6186 |
| ENT-48-10F | Enterprise Switch 10GigE SFP+ 48 port              |     4329 |
| BAS-08-1 C | Basic Switch  10/100/1000 BaseT 8 port             |     4285 |
| ENT-24-10F | Enterprise Switch 10GigE SFP+ 24 Port              |     4275 |
| ADV-24-10C | Advanced Switch 10GigE Copper 24 port              |     4178 |
| ADV-48-10F | Advanced Switch 10 GigE Copper/Fiber 44 port coppe |     4174 |
| ENT-24-40F | Enterprise Switch 40GigE SFP+ 24 port              |     2152 |
| BAS-24-1 C | Basic Switch 10/100/1000 BaseT 24 port             |       34 |
+------------+----------------------------------------------------+----------+
9 rows in set (0.07 sec)

# Analyze the data to determine the top three products sold in the southeastern region of the United States.



